{
  "$schema": "https://json-schema.org/draft/2020-12/schema",
  "$id": "https://a2dlc.local/contracts/mutation.schema.json",
  "title": "Kill gate of Stage 5 (.a2dlc/run/<slice>/mutation.json, not committed)",
  "description": "Protocol §5, Stage 5 step 3: gate of the suite, not of the candidate. The mutants come from the changed lines (operation: mutate of the engine); each one is judged with the set T (the candidate's changed tests + the run's overlay) on the candidate with the mutated file on top, against a clean run of T on the candidate. kill_rate = killed / (killed + survived). PASS only if kill_rate >= threshold and nothing was left unrun or ungenerated (not_run, not_generated): what was not measured does not count as killed.",
  "type": "object",
  "properties": {
    "schema_version": { "$ref": "defs.schema.json#/$defs/schema_version" },
    "round": { "type": "integer", "minimum": 0, "description": "Saboteur rounds done in Stage 5 when it was written." },
    "threshold": { "type": "number", "minimum": 0, "maximum": 1 },
    "max_mutants": { "type": "integer", "minimum": 1 },
    "tests": {
      "description": "Test files of T against which each mutant was judged. Empty: nothing can kill a mutant and all of them survive without running anything (running the command without files would run the full suite).",
      "type": "array", "items": { "type": "string", "minLength": 1 }, "uniqueItems": true
    },
    "red_on_candidate": {
      "description": "Tests of T red in the candidate without mutating: they cannot kill anyone. If there is any, the stage stops at INCONCLUSIVE: a red test would kill everything and fake kill_rate 1.",
      "type": "array", "items": { "type": "string", "minLength": 1 }, "uniqueItems": true
    },
    "mutants": {
      "type": "array",
      "items": {
        "type": "object",
        "properties": {
          "id": { "type": "string", "pattern": "^[A-Za-z0-9][A-Za-z0-9_-]{0,63}$" },
          "file": { "type": "string", "minLength": 1 },
          "line": { "type": "integer", "minimum": 1 },
          "operator": { "$ref": "engine-mutate-response.schema.json#/$defs/operator" },
          "description": { "type": "string", "minLength": 1 },
          "status": {
            "description": "killed: a test green in the clean run turned red. survived: all stay green. inconclusive: the run could not be judged (no JUnit, no testcases, red without an identifiable test, timeout); it does not enter kill_rate. not_run: not run (max_mutants cap, interrupted run).",
            "enum": ["killed", "survived", "inconclusive", "not_run"]
          },
          "killed_by": { "type": "array", "items": { "type": "string", "minLength": 1 }, "uniqueItems": true },
          "reason": { "type": "string", "minLength": 1 }
        },
        "required": ["id", "file", "line", "operator", "description", "status", "killed_by"],
        "additionalProperties": false,
        "allOf": [
          {
            "if": { "properties": { "status": { "const": "killed" } } },
            "then": { "properties": { "killed_by": { "minItems": 1 } } },
            "else": { "properties": { "killed_by": { "maxItems": 0 } } }
          },
          {
            "if": { "properties": { "status": { "enum": ["inconclusive", "not_run"] } } },
            "then": { "required": ["reason"] }
          }
        ]
      }
    },
    "not_generated": {
      "description": "What the engine did not turn into mutants (file that does not parse, max_mutants cap of the engine). Prevents PASS.",
      "type": "array",
      "items": { "$ref": "#/$defs/file_reason" }
    },
    "unsupported": {
      "description": "Changed files in scope that no engine mutates, with the reason. The PASS gate reads unsupported_files, which lists the same files without reasons: any of them blocks PASS.",
      "type": "array",
      "items": { "$ref": "#/$defs/file_reason" }
    },
    "unsupported_files": {
      "description": "Changed files in scope that no engine mutated (no engine, or its engine has no operation: mutate). Unlike unsupported, they block PASS: a file nobody mutated is not measured.",
      "type": "array",
      "items": { "type": "string", "minLength": 1 },
      "uniqueItems": true
    },
    "pruned_equivalent": {
      "description": "Equivalent mutants that the engine pruned (conservative AST: logging, assert, branch with constant condition) in the changed lines, with the reason. They are not mutants: they do not enter mutants, kill_rate, nor block PASS. Empty if nothing was pruned.",
      "type": "array",
      "items": { "$ref": "engine-mutate-response.schema.json#/$defs/pruned" }
    },
    "kill_rate": { "oneOf": [{ "type": "null" }, { "type": "number", "minimum": 0, "maximum": 1 }], "description": "null if no mutant ended up killed or survived." },
    "verdict": { "enum": ["PASS", "INCONCLUSIVE"] },
    "reason": { "type": "string", "minLength": 1 }
  },
  "required": ["schema_version", "round", "threshold", "max_mutants", "tests", "red_on_candidate", "mutants", "not_generated", "pruned_equivalent", "unsupported", "kill_rate", "verdict"],
  "additionalProperties": false,
  "allOf": [
    {
      "if": { "properties": { "verdict": { "const": "INCONCLUSIVE" } } },
      "then": { "required": ["reason"] }
    },
    {
      "if": { "properties": { "verdict": { "const": "PASS" } } },
      "then": {
        "properties": {
          "kill_rate": { "type": "number" },
          "not_generated": { "maxItems": 0 },
          "unsupported_files": { "maxItems": 0 },
          "red_on_candidate": { "maxItems": 0 },
          "mutants": { "items": { "properties": { "status": { "not": { "enum": ["not_run", "inconclusive"] } } } } }
        }
      }
    }
  ],
  "$defs": {
    "file_reason": {
      "type": "object",
      "properties": {
        "file": { "type": "string", "minLength": 1 },
        "reason": { "type": "string", "minLength": 1 }
      },
      "required": ["file", "reason"],
      "additionalProperties": false
    }
  }
}
